1552256_a_at;SCARB1;379.17;201.948;351.038;199.331;156.914;115.743;162.999;143.081;204.112;125.868;146.302;106.142;110.341;156.711;115.232;148.896;185.943;329.912;173.299;318.824;332.25;296.576;161.584;294.023;301.945;405.037;430.803;291.661;237.53;214.872;158.654;118.328;361.51;358.204;302.664;224.105;159.192;117.33;164.995;169.642;209.144;437.497;109.568;425.252;398.495;218.887;197.466;188.533;188.371;241.803;185.335;145.293;163.752;261.596;260.73;115.161;280.936;107.488;110.48;211.272;222.288;318.549;174.659;208.152;156.44;145.32;241.246;173.893;118.939;198.264;176.023;123.182;190.836;179.377;273.27;205.411;212.638;288.359;200.816;195.407;318.526;354.967;172.148;167.426;178.359;174.546;125.493;176.722;283.334;130.994;163.404;180.141;101.549;122.09;967.633;353.704;163.681;109.403;122.302;232.56;410.058;262.691;276.239;219.535;239.282;226.459;208.813;135.379;157.85;247.693;196.777;196.437;222.064;154.536;224.768;159.352;153.814;216.269;303.231;274.335;216.534;245.384;348.618;251.161;147.615;263.535;164.936;114.252;460.89;355.428;219.582;275.166;130.227;148.628;230.475;996.641;135.135;168.661;165.364;134.805;199.288;143.401;165.245;300.101;112.152;226.72;159.801;298.549;357.47;305.226;313.856;173.693;293.05;118.511;208.903;285.023;699.914;316.216;287.571;202.399;347.966;394.156;321.917;342.84;274.572;221.01;175.732;230.01;254.824;156.271;251.116;157.231;182.624;167.065;203.914;124.551;195.879;159.801;205.507;189.268;258.718;286.31;465.864;157.628;129.274;155.631;184.25;160.597;173.849;128.156;277.956;266.523;334.074;289.4;168.552;199.575;190.589;271.582;174.049;218.288;scavenger receptor class B member 1;SCARB1;949;;;;Homo sapiens scavenger receptor class B member 1 (SCARB1), transcript variant 1, mRNA;132566683;NM_005505;;;;12q24.31;Chromosome 12, NC_000012.12 (124777628..124863973, complement);1-phosphatidylinositol binding///apolipoprotein A-I binding///apolipoprotein binding///high-density lipoprotein particle binding///high-density lipoprotein particle receptor activity///high-density lipoprotein particle receptor activity///lipopolysaccharide binding///lipopolysaccharide receptor activity///low-density lipoprotein particle binding///phosphatidylserine binding///protein binding///protein homodimerization activity///transporter activity///virus receptor activity;adhesion of symbiont to host///androgen biosynthetic process///blood vessel endothelial cell migration///cholesterol catabolic process///cholesterol efflux///cholesterol efflux///cholesterol homeostasis///cholesterol import///cholesterol import///detection of lipopolysaccharide///endothelial cell proliferation///high-density lipoprotein particle clearance///high-density lipoprotein particle remodeling///intestinal absorption///lipopolysaccharide transport///lipopolysaccharide-mediated signaling pathway///lipoprotein metabolic process///low-density lipoprotein particle clearance///phospholipid transport///positive regulation of cholesterol storage///positive regulation of endothelial cell migration///positive regulation of nitric-oxide synthase activity///positive regulation of triglyceride biosynthetic process///receptor-mediated endocytosis///recognition of apoptotic cell///regulation of phagocytosis///regulation of phosphatidylcholine catabolic process///reverse cholesterol transport///triglyceride homeostasis///viral entry into host cell///vitamin transmembrane transport///wound healing;caveola///cell surface///endocytic vesicle membrane///extracellular exosome///integral component of plasma membrane///intracellular membrane-bounded organelle///lysosomal membrane///microvillus membrane///plasma membrane///plasma membrane;GO:0005545///GO:0034186///GO:0034185///GO:0008035///GO:0070506///GO:0070506///GO:0001530///GO:0001875///GO:0030169///GO:0001786///GO:0005515///GO:0042803///GO:0005215///GO:0001618;GO:0044406///GO:0006702///GO:0043534///GO:0006707///GO:0033344///GO:0033344///GO:0042632///GO:0070508///GO:0070508///GO:0032497///GO:0001935///GO:0034384///GO:0034375///GO:0050892///GO:0015920///GO:0031663///GO:0042157///GO:0034383///GO:0015914///GO:0010886///GO:0010595///GO:0051000///GO:0010867///GO:0006898///GO:0043654///GO:0050764///GO:0010899///GO:0043691///GO:0070328///GO:0046718///GO:0035461///GO:0042060;GO:0005901///GO:0009986///GO:0030666///GO:0070062///GO:0005887///GO:0043231///GO:0005765///GO:0031528///GO:0005886///GO:0005886
1552257_a_at;TTLL12;478.071;300.534;467.192;357.624;248.407;283.457;236.633;208.948;253.342;374.689;235.358;118.208;198.958;169.392;226.981;365.543;331.951;377.779;258.225;267.832;254.219;350.255;219.195;612.398;764.356;574.756;340.98;431.409;332.98;428.543;178.797;277.596;457.581;416.189;340.55;255.744;198.987;168.418;209.317;182.046;349.801;400.828;350.835;331.759;315.647;376.665;343.507;359.147;305.501;177.194;329.188;465.126;238.748;443.671;465.612;364.439;362.005;188.737;312.964;185.422;371.464;289.087;306.283;286.516;263.449;247.577;237.624;496.285;575.233;355.364;370.208;256.519;466.805;261.53;204.304;315.011;212.577;389.891;340.305;485.044;310.639;342.42;234.951;245.631;104.172;116.098;337.302;183.653;364.098;246.9;314.059;160.748;122.456;161.246;106.717;398.582;244.422;133.154;184.124;217.347;208.715;262.18;302.446;175.744;268.895;189.159;126.779;174.294;132.417;238.619;324.97;177.692;288.796;269.399;133.274;298.527;336.162;179.235;210.838;420.893;301.315;218.69;396.677;293.441;269.69;428.79;239.799;154.447;491.021;268.74;304.764;144.781;229.348;414.962;338.642;387.887;350.886;535.864;333.173;281.3;217.206;290.381;565.983;308.364;237.248;318.985;369.289;404.075;518.545;482.917;485.534;359.471;399.271;361.862;372.938;465.495;380.017;372.026;597.665;778.642;625.328;360.755;337.132;576.186;575.233;341.755;308.187;299.604;420.121;517.686;254.32;560.262;463.988;415.56;267.263;388.657;170.322;441.741;505.341;378.215;362.631;610.548;549.667;276.438;252.594;210.353;265.698;225.384;168.418;792.571;257.872;318.491;307.599;214.153;265.249;377.507;280.885;276.269;219.519;250.384;tubulin tyrosine ligase like 12;TTLL12;23170;;;;Homo sapiens tubulin tyrosine ligase like 12 (TTLL12), mRNA;296010883;NM_015140;;;;22q13.31;Chromosome 22, NC_000022.11 (43166622..43187131, complement);ATP binding;cellular protein modification process;;GO:0005524;GO:0006464;
1552258_at;LOC101930489;563.121;764.969;441.681;308.334;383.487;296.579;54.492;653.123;45.884;837.753;64.313;542.883;472.613;446.593;598.447;67.63;534.365;345.558;639.342;424.231;416.208;353.618;320.058;414.413;45.099;689.982;383.114;392.685;343.078;449.514;711.795;350.346;803.843;951.834;49.223;299.543;387.388;323.548;437.233;259.692;401.265;846.977;475.499;774.731;636.607;483.444;464.929;551.716;478.247;303.354;607.767;586.242;416.868;370.518;999.086;889.538;387.067;333.632;362.556;308.345;875.297;326.734;622.906;440.712;359.785;461.891;481.844;628.337;134.383;447.849;481.844;396.152;784.052;277.318;431.164;615.301;538.287;626.755;797.842;105.285;76.809;502.768;623.781;408.131;320.751;311.101;461.908;364.337;445.243;365.073;511.021;825.114;298.616;403.817;51.984;137.25;499.302;374.504;472.068;413.771;297.982;51.57;471.405;508.578;412.328;311.909;454.382;404.152;334.402;492.851;465.533;492.567;367.871;435.158;661.005;477.232;559.602;524.978;480.579;494.701;952.416;528.831;51.012;639.458;384.067;522.393;501.014;342.633;365.915;59.808;38.562;387.012;51.233;556.827;498.817;335.403;329.582;41.519;343.634;363.158;493.171;461.974;746.781;119.2;516.499;440.727;719.296;874.415;809.101;387.276;679.328;560.611;380.322;845.667;57.559;920.971;418.976;518.419;921.004;52.906;647.711;542.179;544.293;61.601;469.034;389.641;484.751;454.399;482.869;450.033;372.499;713.978;47.603;635.324;537.357;601.017;383.141;557.007;620.375;653.382;460.861;419.233;753.374;380.706;471.592;499.932;48.615;41.881;452.895;655.952;365.218;405.085;443.595;569.793;476.527;401.887;442.557;420.337;398.485;336.323;uncharacterized LOC101930489///long intergenic non-protein coding RNA 152;LOC101930489///LINC00152;101930489///112597;;;;;;;;;;2p11.2;Chromosome 2///Chromosome 2, NC_000002.12 (87455455..87521518);;;;;;
1552261_at;WFDC2;157.159;146.921;26.715;179.903;200.753;221.866;205.879;173.825;172.441;143.005;192.703;211.502;202.875;219.481;196.092;231.901;158.341;163.606;200.175;165.431;132.777;170.023;153.821;111.492;162.174;184.923;135.024;168.317;214.386;958.585;164.208;177.815;131.113;153.334;156.571;171.623;283.735;233.241;207.517;149.828;155.918;161.172;213.708;177.956;148.293;208.311;192.564;167.808;132.366;168.839;141.631;173.013;124.351;160.848;152.113;159.992;221.323;200.261;24.124;153.356;134.558;176.793;180.878;18.527;202.729;155.694;135.209;197.681;155.268;176.819;152.343;235.793;181.361;195.289;203.461;169.192;163.264;173.588;134.646;141.753;169.094;15.025;164.646;162.069;193.092;225.086;190.165;168.632;223.889;230.004;213.677;136.246;248.025;175.853;175.145;156.121;206.265;218.976;210.044;182.383;179.385;186.556;21.631;199.311;24.337;199.498;180.604;145.216;194.853;197.966;215.594;200.608;182.593;16.555;190.714;191.872;222.635;194.727;129.582;144.621;132.223;147.218;184.218;149.333;223.809;194.572;201.913;188.623;208.942;157.454;181.125;159.601;166.292;173.238;198.095;201.913;166.172;17.028;242.477;225.378;182.883;227.761;105.195;127.618;195.782;165.193;234.522;238.046;179.929;224.535;190.001;186.287;206.369;202.088;200.391;237.994;139.574;164.173;152.629;165.837;151.195;135.825;149.753;153.489;18.551;172.118;218.787;214.232;18.455;171.524;227.663;172.988;198.996;159.325;167.639;18.157;186.905;165.193;193.092;14.971;314.028;239.439;155.022;23.13;205.094;204.519;196.517;233.124;206.206;185.163;198.996;17.874;215.999;207.472;210.165;175.613;203.285;173.713;158.409;150.977;WAP four-disulfide core domain 2;WFDC2;10406;;;;;;;;;;20q13.12;Chromosome 20, NC_000020.11 (45469754..45481532);aspartic-type endopeptidase inhibitor activity///cysteine-type endopeptidase inhibitor activity///endopeptidase inhibitor activity///serine-type endopeptidase inhibitor activity;negative regulation of endopeptidase activity///proteolysis///spermatogenesis;extracellular exosome///extracellular space;GO:0019828///GO:0004869///GO:0004866///GO:0004867;GO:0010951///GO:0006508///GO:0007283;GO:0070062///GO:0005615
1552263_at;MAPK1;142.018;157.838;112.427;151.652;791.744;127.534;100.722;116.19;143.302;108.739;147.068;365.652;100.584;468.561;840.594;665.928;172.601;124.332;115.877;146.856;193.264;123.827;249.457;783.516;766.707;103.056;161.008;154.319;213.152;763.675;151.619;182.776;132.623;107.818;155.021;114.933;131.462;100.903;854.947;167.456;173.111;121.836;819.013;819.072;134.122;110.914;119.407;160.858;107.206;142.947;104.921;126.907;119.881;952.244;170.144;118.772;117.056;742.302;134.829;619.995;195.189;137.725;117.115;122.681;684.609;142.448;141.181;106.867;101.956;849.452;149.331;966.273;105.771;130.011;134.402;149.041;147.567;104.236;166.674;188.69;141.1;114.958;158.351;862.806;666.528;659.768;107.709;156.705;135.101;106.713;166.704;102.737;145.917;502.405;779.967;663.581;892.265;761.148;473.413;273.28;785.211;730.498;114.85;113.944;549.117;984.048;725.645;819.131;484.646;125.195;710.334;413.414;150.184;747.454;114.293;803.582;103.973;141.844;118.49;925.193;225.327;111.243;84.387;176.741;112.451;163.157;162.079;951.695;609.411;167.372;147.62;122.933;100.823;729.314;154.141;131.951;113.862;913.964;114.693;737.238;890.018;149.181;717.122;164.882;726.168;111.556;117.8;165.728;103.368;136.245;89.862;133.101;529.002;550.662;922.332;155.429;851.627;157.998;159.945;239.886;152.462;115.439;166.015;118.626;123.956;737.504;122.823;122.086;130.321;142.079;122.65;113.061;122.28;104.033;810.326;120.045;828.449;108.426;869.357;914.326;124.188;698.409;142.551;125.068;164.088;156.243;872.935;103.108;683.919;484.385;146.096;107.005;166.434;651.501;853.255;115.057;121.009;108.935;103.108;122.482;mitogen-activated protein kinase 1;MAPK1;5594;;;;Homo sapiens mitogen-activated protein kinase 1 (MAPK1), transcript variant 2, mRNA;576796259;NM_138957;;;;22q11.21;Chromosome 22, NC_000022.11 (21759657..21867680, complement);ATP binding///DNA binding///MAP kinase activity///RNA polymerase II carboxy-terminal domain kinase activity///identical protein binding///kinase activity///mitogen-activated protein kinase kinase kinase binding///phosphatase binding///phosphotyrosine binding///protein binding///protein serine/threonine kinase activity///protein serine/threonine kinase activity///transcription factor binding;B cell receptor signaling pathway///Bergmann glial cell differentiation///ERBB signaling pathway///ERK1 and ERK2 cascade///ERK1 and ERK2 cascade///Fc-epsilon receptor signaling pathway///Fc-gamma receptor signaling pathway involved in phagocytosis///JAK-STAT cascade involved in growth hormone signaling pathway///MAPK cascade///MAPK import into nucleus///T cell receptor signaling pathway///activation of MAPK activity///apoptotic process///axon guidance///cardiac neural crest cell development involved in heart development///caveolin-mediated endocytosis///cell cycle///cellular response to DNA damage stimulus///cellular response to granulocyte macrophage colony-stimulating factor stimulus///chemical synaptic transmission///chemotaxis///cytosine metabolic process///face development///fibroblast growth factor receptor signaling pathway///labyrinthine layer blood vessel development///lipopolysaccharide-mediated signaling pathway///long-term synaptic potentiation///lung morphogenesis///mammary gland epithelial cell proliferation///negative regulation of cell differentiation///outer ear morphogenesis///peptidyl-serine phosphorylation///peptidyl-threonine phosphorylation///platelet activation///positive regulation of cell migration///positive regulation of cell proliferation///positive regulation of peptidyl-threonine phosphorylation///positive regulation of telomerase activity///positive regulation of telomere capping///positive regulation of telomere maintenance via telomerase///positive regulation of transcription, DNA-templated///positive regulation of translation///protein phosphorylation///regulation of Golgi inheritance///regulation of cellular response to heat///regulation of cytoskeleton organization///regulation of early endosome to late endosome transport///regulation of phosphatidylinositol 3-kinase signaling///regulation of protein stability///regulation of sequence-specific DNA binding transcription factor activity///regulation of stress-activated MAPK cascade///response to epidermal growth factor///response to estrogen///response to exogenous dsRNA///response to stress///response to toxic substance///sensory perception of pain///signal transduction///thymus development///thyroid gland development///trachea formation///transcription, DNA-templated///viral process;Golgi apparatus///axon///caveola///cytoplasm///cytoplasm///cytoskeleton///cytosol///dendrite cytoplasm///early endosome///extracellular exosome///focal adhesion///late endosome///microtubule cytoskeleton///microtubule organizing center///mitochondrion///mitotic spindle///nucleoplasm///nucleoplasm///nucleus///nucleus///perikaryon///protein complex///pseudopodium;GO:0005524///GO:0003677///GO:0004707///GO:0008353///GO:0042802///GO:0016301///GO:0031435///GO:0019902///GO:0001784///GO:0005515///GO:0004674///GO:0004674///GO:0008134;GO:0050853///GO:0060020///GO:0038127///GO:0070371///GO:0070371///GO:0038095///GO:0038096///GO:0060397///GO:0000165///GO:0000189///GO:0050852///GO:0000187///GO:0006915///GO:0007411///GO:0061308///GO:0072584///GO:0007049///GO:0006974///GO:0097011///GO:0007268///GO:0006935///GO:0019858///GO:0060324///GO:0008543///GO:0060716///GO:0031663///GO:0060291///GO:0060425///GO:0033598///GO:0045596///GO:0042473///GO:0018105///GO:0018107///GO:0030168///GO:0030335///GO:0008284///GO:0010800///GO:0051973///GO:1904355///GO:0032212///GO:0045893///GO:0045727///GO:0006468///GO:0090170///GO:1900034///GO:0051493///GO:2000641///GO:0014066///GO:0031647///GO:0051090///GO:0032872///GO:0070849///GO:0043627///GO:0043330///GO:0006950///GO:0009636///GO:0019233///GO:0007165///GO:0048538///GO:0030878///GO:0060440///GO:0006351///GO:0016032;GO:0005794///GO:0030424///GO:0005901///GO:0005737///GO:0005737///GO:0005856///GO:0005829///GO:0032839///GO:0005769///GO:0070062///GO:0005925///GO:0005770///GO:0015630///GO:0005815///GO:0005739///GO:0072686///GO:0005654///GO:0005654///GO:0005634///GO:0005634///GO:0043204///GO:0043234///GO:0031143
1552264_a_at;MAPK1;143.877;180.271;160.933;170.604;115.677;209.204;174.307;119.92;193.139;145.828;218.793;858.188;161.642;86.795;160.956;893.005;237.308;186.668;232.392;262.199;265.335;263.335;419.38;264.59;194.999;225.563;156.937;174.885;209.793;214.933;181.144;108.156;137.131;141.839;159.364;240.726;227.997;145.163;155.317;237.778;180.077;219.55;96.819;138.506;180.323;193.983;175.599;213.575;162.477;187.828;166.824;167.438;181.052;266.715;314.15;169.367;192.472;996.642;186.601;126.925;236.838;208.858;147.445;148.671;106.031;166.188;179.597;145.021;133.231;122.328;212.149;141.869;167.607;180.038;132.208;202.37;216.503;135.077;171.788;230.334;176.633;163.187;171.417;159.146;114.005;136.034;162.799;157.05;156.564;150.796;196.82;137.013;171.912;689.982;116.925;120.961;132.084;159.295;994.203;510.244;199.741;166.452;256.436;216.862;114.417;225.677;174.018;120.335;847.435;180.141;943.129;814.335;198.614;918.056;133.231;114.78;118.042;178.578;153.294;105.103;231.941;133.798;970.705;214.763;165.102;234.63;209.642;129.773;270.372;224.404;214.717;211.066;130.269;108.351;203.013;202.472;169.966;162.132;191.836;109.41;133.856;188.038;278.277;187.22;148.329;152.007;220.804;316.262;250.222;263.658;237.026;305.633;152.666;150.265;104.857;166.308;158.699;187.396;167.318;242.694;167.318;164.568;167.499;152.27;205.026;147.158;183.283;212.976;194.256;155.833;181.509;145.409;156.711;153.018;137.047;162.852;129.381;129.157;128.313;134.707;175.732;303.275;209.144;179.016;186.198;193.669;149.687;142.279;108.281;913.438;254.293;250.132;327.532;157.016;171.319;171.442;179.352;158.311;134.95;162.038;mitogen-activated protein kinase 1;MAPK1;5594;;;;Homo sapiens mitogen-activated protein kinase 1 (MAPK1), transcript variant 2, mRNA;576796259;NM_138957;;;;22q11.21;Chromosome 22, NC_000022.11 (21759657..21867680, complement);ATP binding///DNA binding///MAP kinase activity///RNA polymerase II carboxy-terminal domain kinase activity///identical protein binding///kinase activity///mitogen-activated protein kinase kinase kinase binding///phosphatase binding///phosphotyrosine binding///protein binding///protein serine/threonine kinase activity///protein serine/threonine kinase activity///transcription factor binding;B cell receptor signaling pathway///Bergmann glial cell differentiation///ERBB signaling pathway///ERK1 and ERK2 cascade///ERK1 and ERK2 cascade///Fc-epsilon receptor signaling pathway///Fc-gamma receptor signaling pathway involved in phagocytosis///JAK-STAT cascade involved in growth hormone signaling pathway///MAPK cascade///MAPK import into nucleus///T cell receptor signaling pathway///activation of MAPK activity///apoptotic process///axon guidance///cardiac neural crest cell development involved in heart development///caveolin-mediated endocytosis///cell cycle///cellular response to DNA damage stimulus///cellular response to granulocyte macrophage colony-stimulating factor stimulus///chemical synaptic transmission///chemotaxis///cytosine metabolic process///face development///fibroblast growth factor receptor signaling pathway///labyrinthine layer blood vessel development///lipopolysaccharide-mediated signaling pathway///long-term synaptic potentiation///lung morphogenesis///mammary gland epithelial cell proliferation///negative regulation of cell differentiation///outer ear morphogenesis///peptidyl-serine phosphorylation///peptidyl-threonine phosphorylation///platelet activation///positive regulation of cell migration///positive regulation of cell proliferation///positive regulation of peptidyl-threonine phosphorylation///positive regulation of telomerase activity///positive regulation of telomere capping///positive regulation of telomere maintenance via telomerase///positive regulation of transcription, DNA-templated///positive regulation of translation///protein phosphorylation///regulation of Golgi inheritance///regulation of cellular response to heat///regulation of cytoskeleton organization///regulation of early endosome to late endosome transport///regulation of phosphatidylinositol 3-kinase signaling///regulation of protein stability///regulation of sequence-specific DNA binding transcription factor activity///regulation of stress-activated MAPK cascade///response to epidermal growth factor///response to estrogen///response to exogenous dsRNA///response to stress///response to toxic substance///sensory perception of pain///signal transduction///thymus development///thyroid gland development///trachea formation///transcription, DNA-templated///viral process;Golgi apparatus///axon///caveola///cytoplasm///cytoplasm///cytoskeleton///cytosol///dendrite cytoplasm///early endosome///extracellular exosome///focal adhesion///late endosome///microtubule cytoskeleton///microtubule organizing center///mitochondrion///mitotic spindle///nucleoplasm///nucleoplasm///nucleus///nucleus///perikaryon///protein complex///pseudopodium;GO:0005524///GO:0003677///GO:0004707///GO:0008353///GO:0042802///GO:0016301///GO:0031435///GO:0019902///GO:0001784///GO:0005515///GO:0004674///GO:0004674///GO:0008134;GO:0050853///GO:0060020///GO:0038127///GO:0070371///GO:0070371///GO:0038095///GO:0038096///GO:0060397///GO:0000165///GO:0000189///GO:0050852///GO:0000187///GO:0006915///GO:0007411///GO:0061308///GO:0072584///GO:0007049///GO:0006974///GO:0097011///GO:0007268///GO:0006935///GO:0019858///GO:0060324///GO:0008543///GO:0060716///GO:0031663///GO:0060291///GO:0060425///GO:0033598///GO:0045596///GO:0042473///GO:0018105///GO:0018107///GO:0030168///GO:0030335///GO:0008284///GO:0010800///GO:0051973///GO:1904355///GO:0032212///GO:0045893///GO:0045727///GO:0006468///GO:0090170///GO:1900034///GO:0051493///GO:2000641///GO:0014066///GO:0031647///GO:0051090///GO:0032872///GO:0070849///GO:0043627///GO:0043330///GO:0006950///GO:0009636///GO:0019233///GO:0007165///GO:0048538///GO:0030878///GO:0060440///GO:0006351///GO:0016032;GO:0005794///GO:0030424///GO:0005901///GO:0005737///GO:0005737///GO:0005856///GO:0005829///GO:0032839///GO:0005769///GO:0070062///GO:0005925///GO:0005770///GO:0015630///GO:0005815///GO:0005739///GO:0072686///GO:0005654///GO:0005654///GO:0005634///GO:0005634///GO:0043204///GO:0043234///GO:0031143
1552266_at;ADAM32;121.394;11.861;131.019;110.612;246.955;117.369;147.973;131.179;117.666;119.571;126.156;164.563;168.985;12.961;149.559;157.136;140.513;115.058;189.004;148.957;114.546;125.151;986.044;125.232;15.275;124.611;110.533;129.966;11.775;133.795;170.317;169.131;116.124;119.442;125.602;136.109;132.528;140.048;180.682;123.788;137.806;183.675;142.634;169.131;131.463;124.136;158.832;152.541;166.747;130.802;151.456;15.308;122.078;145.394;120.505;157.919;114.002;138.433;148.603;118.747;10.521;478.023;116.602;14.856;154.654;133.102;156.323;389.908;18.153;237.737;12.221;260.516;159.142;108.567;149.624;258.777;116.897;238.012;104.892;117.742;17.044;118.269;32.214;138.094;146.762;125.331;283.633;121.894;182.461;192.065;106.968;110.612;193.957;115.524;43.9;145.608;141.722;133.544;12.907;953.832;124.387;11.392;136.511;113.461;285.972;15.138;321.422;15.897;12.488;240.407;179.075;234.117;187.175;135.482;112.177;561.823;128.624;16.622;187.229;138.293;125.892;112.972;114.447;97.355;227.975;108.052;116.501;120.419;148.721;107.168;126.228;122.026;228.205;126.319;182.277;219.924;160.061;140.796;133.237;149.764;184.112;259.168;144.965;178.547;289.872;140.149;146.361;167.446;221.307;156.763;223.309;145.772;207.009;151.511;144.153;417.439;382.397;121.088;126.256;20.168;189.932;151.129;132.605;112.339;13.051;213.985;160.258;138.962;142.306;180.787;138.024;15.759;155.022;152.376;133.506;167.096;11.781;127.031;133.679;122.501;125.205;152.332;125.151;175.032;166.316;170.919;140.594;152.904;168.317;128.884;136.325;130.247;146.024;136.679;144.882;116.074;107.462;11.035;109.014;116.745;ADAM metallopeptidase domain 32;ADAM32;203102;;;;Homo sapiens ADAM metallopeptidase domain 32 (ADAM32), transcript variant 1, mRNA;929524262;NM_145004;;;;8p11.22;Chromosome 8, NC_000008.11 (39107529..39284917);metalloendopeptidase activity///zinc ion binding;proteolysis;integral component of membrane;GO:0004222///GO:0008270;GO:0006508;GO:0016021
