ID_REF;IDENTIFIER;GSM483301;GSM483302;GSM483303;GSM483305;GSM483307;GSM483312;GSM483313;GSM483317;GSM483318;GSM483319;GSM483322;GSM483327;GSM483328;GSM483330;GSM483332;GSM483333;GSM483336;GSM483337;GSM483339;GSM483351;GSM483352;GSM483354;GSM483358;GSM483384;GSM483386;GSM483388;GSM483390;GSM483391;GSM483396;GSM483399;GSM483400;GSM483401;GSM483412;GSM483418;GSM483420;GSM483421;GSM483426;GSM483428;GSM483431;GSM483436;GSM483442;GSM483443;GSM483444;GSM483447;GSM483448;GSM483450;GSM483455;GSM483458;GSM483461;GSM483462;GSM483464;GSM483466;GSM483468;GSM483476;GSM483477;GSM483300;GSM483308;GSM483310;GSM483311;GSM483323;GSM483338;GSM483353;GSM483361;GSM483363;GSM483364;GSM483366;GSM483368;GSM483371;GSM483372;GSM483373;GSM483374;GSM483379;GSM483380;GSM483381;GSM483389;GSM483404;GSM483405;GSM483410;GSM483411;GSM483413;GSM483416;GSM483417;GSM483419;GSM483427;GSM483433;GSM483434;GSM483445;GSM483459;GSM483465;GSM483470;GSM483473;GSM483478;GSM483304;GSM483315;GSM483320;GSM483325;GSM483329;GSM483331;GSM483334;GSM483341;GSM483343;GSM483344;GSM483347;GSM483348;GSM483349;GSM483350;GSM483356;GSM483362;GSM483365;GSM483367;GSM483369;GSM483370;GSM483375;GSM483376;GSM483377;GSM483378;GSM483385;GSM483402;GSM483403;GSM483406;GSM483407;GSM483408;GSM483414;GSM483415;GSM483424;GSM483437;GSM483439;GSM483440;GSM483446;GSM483449;GSM483454;GSM483456;GSM483460;GSM483463;GSM483471;GSM483297;GSM483298;GSM483299;GSM483306;GSM483309;GSM483314;GSM483316;GSM483321;GSM483324;GSM483326;GSM483335;GSM483340;GSM483342;GSM483345;GSM483346;GSM483355;GSM483357;GSM483359;GSM483360;GSM483382;GSM483383;GSM483387;GSM483392;GSM483393;GSM483394;GSM483395;GSM483397;GSM483398;GSM483409;GSM483422;GSM483423;GSM483425;GSM483429;GSM483430;GSM483432;GSM483435;GSM483438;GSM483441;GSM483451;GSM483452;GSM483453;GSM483457;GSM483467;GSM483469;GSM483472;GSM483474;GSM483475;GSM483479;GSM483480;GSM483481;GSM483482;GSM483483;GSM483484;GSM483485;GSM483486;GSM483487;GSM483488;GSM483489;GSM483490;GSM483491;GSM483492;GSM483493;GSM483494;GSM483495;GSM483496;Gene title;Gene symbol;Gene ID;UniGene title;UniGene symbol;UniGene ID;Nucleotide Title;GI;GenBank Accession;Platform_CLONEID;Platform_ORF;Platform_SPOTID;Chromosome location;Chromosome annotation;GO:Function;GO:Process;GO:Component;GO:Function ID;GO:Process ID;GO:Component ID
1007_s_at;MIR4640;106.717;93.792;124.284;103.639;135.475;696.675;146.884;113.179;78.055;696.029;866.567;130.227;201.937;131.561;113.944;638.301;723.297;112.369;672.243;113.48;108.888;110.122;956.198;379.573;608.906;483.217;142.835;919.934;105.943;56.349;912.582;131.173;124.536;828.471;847.519;147.289;144.707;948.308;74.423;130.038;902.139;103.577;73.765;136.672;880.578;126.005;931.288;109.559;723.896;114.133;894.865;897.593;805.582;660.969;423.223;856.388;169.962;119.695;169.893;691.026;817.576;117.645;110.089;93.635;653.917;86.62;776.883;756.311;984.997;67.479;644.917;497.072;591.683;104.042;107.434;112.89;906.561;106.79;848.588;792.143;942.535;103.515;167.973;109.781;730.313;852.088;511.794;546.675;981.941;104.6;552.526;614.099;175.362;924.327;540.332;100.595;151.091;121.643;75.444;820.017;138.07;131.585;120.905;107.861;100.864;140.834;66.941;574.182;971.124;997.576;766.866;518.326;871.113;125.968;607.422;844.631;515.848;920.672;74.576;109.777;612.376;820.526;943.945;999.428;803.286;708.156;122.255;647.623;55.933;682.903;764.942;106.577;85.198;861.339;633.627;131.177;740.353;938.216;156.103;106.818;106.241;118.421;384.843;118.866;133.338;115.028;875.478;813.382;930.441;68.286;883.876;109.042;119.521;691.549;582.888;666.961;165.134;791.944;115.323;108.482;952.819;134.026;111.704;125.061;157.981;117.601;133.549;116.639;154.477;689.987;115.917;652.817;100.762;828.546;773.518;860.222;136.791;896.147;782.373;86.3;986.879;477.158;735.667;226.165;138.208;213.206;139.689;176.891;143.018;155.312;120.104;128.651;122.628;125.091;107.643;106.686;100.45;104.458;123.223;156.999;microRNA 4640///discoidin domain receptor tyrosine kinase 1;MIR4640///DDR1;100616237///780;;;;Human receptor tyrosine kinase DDR gene, complete cds;1753221;U48705;;;;6p21.3;Chromosome 6, NC_000006.12 (30890883..30890972)///Chromosome 6, NC_000006.12 (30880909..30900156);ATP binding///collagen binding///collagen binding///metal ion binding///protein binding///protein tyrosine kinase collagen receptor activity///transmembrane receptor protein tyrosine kinase activity;branching involved in mammary gland duct morphogenesis///cell adhesion///collagen-activated tyrosine kinase receptor signaling pathway///collagen-activated tyrosine kinase receptor signaling pathway///ear development///embryo implantation///extracellular matrix organization///lactation///mammary gland alveolus development///negative regulation of cell proliferation///organ regeneration///peptidyl-tyrosine autophosphorylation///protein autophosphorylation///regulation of cell growth///regulation of cell-matrix adhesion///regulation of extracellular matrix disassembly///skin development///smooth muscle cell migration///smooth muscle cell-matrix adhesion///wound healing, spreading of cells;basolateral plasma membrane///extracellular exosome///extracellular space///integral component of plasma membrane///plasma membrane///receptor complex;GO:0005524///GO:0005518///GO:0005518///GO:0046872///GO:0005515///GO:0038062///GO:0004714;GO:0060444///GO:0007155///GO:0038063///GO:0038063///GO:0043583///GO:0007566///GO:0030198///GO:0007595///GO:0060749///GO:0008285///GO:0031100///GO:0038083///GO:0046777///GO:0001558///GO:0001952///GO:0010715///GO:0043588///GO:0014909///GO:0061302///GO:0044319;GO:0016323///GO:0070062///GO:0005615///GO:0005887///GO:0005886///GO:0043235
1053_at;RFC2;327.523;310.787;229.986;404.673;410.853;278.881;257.886;157.525;236.996;269.348;317.844;249.693;265.454;158.24;242.322;299.696;237.577;411.746;256.148;433.527;399.243;392.95;265.471;318.391;315.232;275.085;381.485;233.763;330.251;335.334;164.823;935.238;294.474;233.774;218.477;320.009;199.041;175.422;124.811;391.59;302.1;243.53;224.991;246.127;229.998;330.26;297.537;282.606;224.372;239.439;232.897;253.079;235.612;291.17;207.607;337.625;571.329;906.406;232.895;209.372;303.34;246.085;304.169;280.579;153.09;207.34;206.245;259.323;195.032;243.315;285.306;180.352;301.554;174.571;225.287;197.92;197.868;233.951;220.464;340.974;356.8;208.572;140.453;440.664;166.512;221.249;248.969;248.548;303.901;202.135;206.133;184.697;218.686;117.33;135.728;302.626;211.281;171.126;127.709;454.071;271.851;222.36;253.922;317.352;178.194;230.427;177.912;177.516;146.873;243.661;185.417;115.448;318.073;230.027;875.431;163.426;276.055;230.464;228.538;397.331;255.811;174.483;282.183;221.896;291.663;368.064;267.422;164.369;223.571;233.269;265.335;194.855;142.996;246.415;188.97;298.046;324.338;329.58;353.013;318.018;219.08;230.618;213.997;187.204;218.584;205.901;252.458;340.553;319.992;509.486;279.18;280.034;329.615;368.176;288.18;355.652;187.91;235.309;399.167;507.206;251.963;229.264;321.497;330.313;407.742;259.297;267.099;405.877;315.289;326.887;389.891;308.081;312.927;280.319;240.173;263.404;197.548;197.286;265.388;310.276;285.036;316.655;163.725;342.797;249.252;198.091;257.586;272.786;209.989;241.638;337.619;362.279;396.47;266.845;280.478;315.553;298.958;282.023;217.978;270.676;replication factor C subunit 2;RFC2;5982;;;;Human replication factor C, 40-kDa subunit (A1) mRNA, complete cds;1590810;M87338;;;;7q11.23;Chromosome 7, NC_000007.14 (74231502..74254458, complement);ATP binding///contributes_to DNA clamp loader activity///enzyme binding///protein binding///contributes_to single-stranded DNA-dependent ATPase activity;DNA damage response, detection of DNA damage///DNA replication///error-free translesion synthesis///error-prone translesion synthesis///nucleotide-excision repair, DNA gap filling///nucleotide-excision repair, DNA incision///nucleotide-excision repair, DNA incision, 5'-to lesion///positive regulation of DNA-directed DNA polymerase activity///regulation of signal transduction by p53 class mediator///telomere maintenance via recombination///transcription-coupled nucleotide-excision repair///translesion synthesis;Ctf18 RFC-like complex///DNA replication factor C complex///nucleoplasm;GO:0005524///contributes_to GO:0003689///GO:0019899///GO:0005515///contributes_to GO:0043142;GO:0042769///GO:0006260///GO:0070987///GO:0042276///GO:0006297///GO:0033683///GO:0006296///GO:1900264///GO:1901796///GO:0000722///GO:0006283///GO:0019985;GO:0031390///GO:0005663///GO:0005654
117_at;HSPA6;189.105;209.023;280.211;226.416;317.555;308.503;337.825;241.795;317.049;265.873;265.273;339.692;310.122;265.705;316.034;241.414;23.444;284.055;273.671;221.118;410.516;252.601;667.952;196.501;270.301;285.414;170.015;257.079;218.637;293.124;216.987;628.105;187.177;388.132;271.494;303.939;346.718;288.575;235.954;290.034;19.275;192.948;240.139;196.853;216.186;255.199;33.107;226.041;196.603;236.024;22.223;303.329;196.699;380.394;207.108;212.796;312.767;282.404;33.625;182.565;769.308;242.054;256.972;317.826;235.546;290.434;376.448;249.086;411.315;235.763;240.678;20.855;372.804;241.164;254.157;240.834;172.329;195.667;238.838;19.691;215.728;179.371;180.242;26.599;310.105;223.807;192.148;195.718;207.684;269.559;314.039;201.006;280.453;218.857;264.872;250.199;277.044;265.297;186.514;253.291;23.665;265.115;37.698;189.649;267.916;227.885;266.034;22.771;227.478;281.792;211.293;197.247;216.647;354.996;244.032;258.842;242.182;247.073;194.392;164.167;208.049;315.514;219.045;200.456;250.693;212.897;209.974;197.779;199.369;178.112;205.368;131.211;18.853;293.381;234.778;303.622;272.901;260.406;335.569;30.96;265.665;241.951;31.237;224.113;313.955;254.852;26.445;295.217;277.306;296.269;22.694;304.068;227.079;319.842;302.279;21.015;175.929;263.603;242.685;31.862;328.063;25.641;198.652;185.717;362.971;256.274;237.081;319.563;284.244;270.089;308.348;33.961;251.672;245.129;221.738;249.931;396.452;237.802;276.383;278.372;386.002;540.488;208.416;339.778;290.839;46.267;277.249;33.511;327.196;276.927;225.376;20.905;257.846;30.48;19.903;248.783;220.567;22.597;234.974;178.322;heat shock protein family A (Hsp70) member 6;HSPA6;3310;;;;Human heat-shock protein HSP70B' gene;35221;X51757;;;;1q23;Chromosome 1, NC_000001.11 (161524540..161526897);ATP binding///ATPase activity, coupled///enzyme binding///heat shock protein binding///protein binding///unfolded protein binding;NOT cellular heat acclimation///cellular response to heat///cellular response to heat///protein refolding///response to unfolded protein;colocalizes_with COP9 signalosome///blood microparticle///centriole///cytoplasm///cytosol///extracellular exosome;GO:0005524///GO:0042623///GO:0019899///GO:0031072///GO:0005515///GO:0051082;NOT GO:0070370///GO:0034605///GO:0034605///GO:0042026///GO:0006986;colocalizes_with GO:0008180///GO:0072562///GO:0005814///GO:0005737///GO:0005829///GO:0070062
121_at;PAX8;224.059;167.828;146.34;206.926;231.432;180.883;247.927;151.879;146.918;165.667;145.681;251.87;237.896;247.443;229.394;145.217;186.489;202.894;212.782;155.551;152.102;139.756;173.711;147.839;190.817;174.272;155.651;125.486;140.201;143.792;154.724;283.868;192.136;237.355;350.81;148.489;145.306;253.483;239.314;162.342;138.083;122.616;178.115;147.182;157.836;185.93;134.783;137.329;131.662;131.725;129.918;171.928;150.748;103.073;746.754;202.724;276.212;253.798;243.657;158.421;165.009;200.018;187.129;136.872;201.267;162.05;125.948;195.653;153.595;180.713;124.746;220.032;166.955;135.314;214.024;224.392;138.362;199.558;162.729;147.535;233.83;266.72;152.377;131.75;172.053;177.508;151.798;120.321;114.781;120.705;141.46;130.058;227.225;135.065;140.663;216.125;289.207;280.635;141.838;171.696;162.199;204.762;175.638;116.774;316.197;165.027;155.089;179.702;186.267;174.304;139.971;165.576;208.079;161.598;120.394;165.597;110.093;112.135;142.201;230.155;139.98;231.228;347.947;221.078;176.634;205.976;128.981;194.18;756.931;102.552;147.615;276.732;177.764;128.838;137.507;196.126;224.344;148.804;272.832;233.17;197.277;132.784;755.991;145.24;310.896;130.817;171.747;200.962;181.24;188.013;196.924;171.2;179.45;146.34;183.936;135.034;227.329;133.866;121.46;151.431;119.434;167.074;212.441;130.449;245.861;162.886;191.289;241.808;213.954;209.693;216.129;191.292;241.442;127.905;187.636;138.408;198.858;159.404;199.453;183.482;139.571;163.702;364.318;225.823;257.737;220.867;283.82;268.17;306.94;169.772;185.484;140.866;192.045;195.222;184.195;136.372;145.487;120.331;138.37;150.195;paired box 8;PAX8;7849;;;;H.sapiens Pax8 mRNA;38425;X69699;;;;2q13;Chromosome 2, NC_000002.12 (113215997..113278950, complement);DNA binding///DNA binding///RNA polymerase II core promoter proximal region sequence-specific DNA binding///RNA polymerase II core promoter sequence-specific DNA binding///protein binding///thyroid-stimulating hormone receptor activity///transcription factor activity, sequence-specific DNA binding///transcription regulatory region DNA binding///transcriptional activator activity, RNA polymerase II core promoter proximal region sequence-specific binding;anatomical structure morphogenesis///branching involved in ureteric bud morphogenesis///cellular response to gonadotropin stimulus///central nervous system development///inner ear morphogenesis///kidney development///mesenchymal to epithelial transition involved in metanephros morphogenesis///mesonephros development///metanephric S-shaped body morphogenesis///metanephric comma-shaped body morphogenesis///metanephric distal convoluted tubule development///metanephric epithelium development///metanephric nephron tubule formation///negative regulation of apoptotic process involved in metanephric collecting duct development///negative regulation of apoptotic process involved in metanephric nephron tubule development///negative regulation of mesenchymal cell apoptotic process involved in metanephric nephron morphogenesis///negative regulation of mesenchymal cell apoptotic process involved in metanephros development///otic vesicle development///positive regulation of branching involved in ureteric bud morphogenesis///positive regulation of mesenchymal to epithelial transition involved in metanephros morphogenesis///positive regulation of metanephric DCT cell differentiation///positive regulation of thyroid hormone generation///positive regulation of transcription from RNA polymerase II promoter///positive regulation of transcription, DNA-templated///positive regulation of transcription, DNA-templated///pronephric field specification///pronephros development///regulation of apoptotic process///regulation of metanephric nephron tubule epithelial cell differentiation///regulation of thyroid-stimulating hormone secretion///sulfur compound metabolic process///thyroid gland development///thyroid gland development///thyroid-stimulating hormone signaling pathway///transcription from RNA polymerase II promoter///transcription, DNA-templated///urogenital system development;nucleoplasm///nucleoplasm///nucleus;GO:0003677///GO:0003677///GO:0000978///GO:0000979///GO:0005515///GO:0004996///GO:0003700///GO:0044212///GO:0001077;GO:0009653///GO:0001658///GO:0071371///GO:0007417///GO:0042472///GO:0001822///GO:0003337///GO:0001823///GO:0072284///GO:0072278///GO:0072221///GO:0072207///GO:0072289///GO:1900215///GO:1900218///GO:0072305///GO:1900212///GO:0071599///GO:0090190///GO:0072108///GO:2000594///GO:2000611///GO:0045944///GO:0045893///GO:0045893///GO:0039003///GO:0048793///GO:0042981///GO:0072307///GO:2000612///GO:0006790///GO:0030878///GO:0030878///GO:0038194///GO:0006366///GO:0006351///GO:0001655;GO:0005654///GO:0005654///GO:0005634
1255_g_at;GUCA1A;798.324;832.968;786.527;871.254;810.611;82.989;859.092;767.495;738.548;837.601;848.511;908.891;916.197;834.966;744.753;697.767;770.938;829.345;882.269;838.855;912.377;751.754;845.293;994.695;679.455;919.711;776.799;729.478;923.745;856.728;830.533;750.145;800.894;833.013;828.262;733.193;732.414;754.766;801.298;761.594;759.608;839.716;764.756;884.783;843.498;778.543;689.702;762.115;799.432;758.247;728.317;829.606;963.545;79.818;763.778;935.389;989.647;786.953;89.208;817.517;788.968;813.895;78.531;823.576;865.226;806.518;819.382;800.411;73.625;75.644;752.764;784.151;79.579;814.254;828.882;858.481;836.147;840.897;698.767;800.844;848.504;719.548;871.136;763.503;790.027;762.486;785.756;742.596;743.433;745.242;764.287;843.916;882.873;878.068;781.922;81.197;78.437;784.222;712.185;7.942;820.645;797.648;766.397;787.938;92.141;827.375;900.256;877.728;781.725;741.146;9.4;773.915;796.084;739.599;873.666;747.043;710.545;74.901;856.326;779.433;839.988;707.633;905.272;846.474;851.865;745.169;823.925;715.483;102.479;833.125;670.411;881.284;83.958;71.417;769.176;891.341;914.145;77.633;879.746;905.378;691.001;779.237;865.194;864.688;892.739;699.945;772.599;842.732;968.748;882.809;882.579;852.379;920.034;791.715;81.186;841.579;863.303;651.003;863.793;761.436;866.942;741.467;802.057;814.518;877.404;823.488;813.609;774.766;735.475;801.328;760.628;739.999;744.451;706.436;786.719;776.037;702.825;80.106;925.452;808.722;871.443;674.663;931.237;825.143;817.296;751.213;95.245;870.031;875.257;788.513;793.507;813.426;821.406;83.921;989.531;750.435;793.972;846.268;749.847;773.316;guanylate cyclase activator 1A;GUCA1A;2978;;;;Homo sapiens guanylate cyclase activating protein (GCAP) gene exons 1-4, complete cds;623404;L36861;;;;6p21.1;Chromosome 6, NC_000006.12 (42155377..42180083);calcium ion binding///calcium sensitive guanylate cyclase activator activity///guanylate cyclase regulator activity;cellular response to calcium ion///phototransduction///positive regulation of guanylate cyclase activity///regulation of rhodopsin mediated signaling pathway///signal transduction///visual perception;photoreceptor disc membrane///photoreceptor inner segment///plasma membrane;GO:0005509///GO:0008048///GO:0030249;GO:0071277///GO:0007602///GO:0031284///GO:0022400///GO:0007165///GO:0007601;GO:0097381///GO:0001917///GO:0005886
1294_at;MIR5193;341.466;351.465;333.56;480.488;182.934;262.121;341.85;208.381;396.802;287.988;343.625;171.404;206.896;396.395;284.126;386.218;508.624;614.93;509.055;413.511;412.603;379.313;400.994;879.731;197.459;615.273;668.639;360.074;418.667;447.692;419.172;632.744;563.364;188.225;463.328;378.406;331.234;163.264;235.044;417.951;578.87;621.902;282.583;686.066;293.687;350.64;389.259;349.511;427.618;837.76;344.266;257.042;434.857;696.211;732.408;168.734;295.292;188.868;271.611;424.632;381.053;421.178;655.551;443.215;609.466;725.992;495.745;375.595;260.523;274.775;204.458;436.324;207.506;676.044;672.141;553.183;962.418;600.536;427.676;435.664;562.244;815.04;819.117;546.1;522.911;417.857;307.643;632.368;545.997;193.371;690.125;1178.05;313.596;376.872;369.708;662.346;323.784;153.699;631.105;521.51;228.203;452.752;1009.84;674.335;444.947;493.18;901.181;498.507;691.942;638.813;657.65;757.388;413.786;292.581;577.293;610.867;480.921;816.627;1480.71;564.807;531.917;960.323;660.487;656.136;526.612;614.559;412.057;595.152;1318.5;656.248;491.867;310.348;513.341;187.357;487.479;225.835;156.923;154.658;143.704;180.697;469.38;386.771;327.91;454.669;117.177;272.53;195.456;389.543;210.27;176.883;202.498;212.42;465.143;360.421;195.027;162.864;543.377;343.254;352.86;261.902;265.531;762.885;302.574;501.569;249.54;470.693;199.014;217.046;188.957;169.852;217.218;174.552;165.501;218.895;276.117;186.386;428.127;160.346;254.838;265.063;314.529;208.101;307.369;231.878;202.93;320.298;373.574;291.642;255.73;322.158;553.537;507.938;448.511;523.151;623.085;526.474;431.891;397.818;500.396;435.802;microRNA 5193///ubiquitin like modifier activating enzyme 7;MIR5193///UBA7;100847079///7318;;;;Homo sapiens ubiquitin-activating enzyme E1 related protein mRNA, complete cds;520832;L13852;;;;3p21;Chromosome 3, NC_000003.12 (49806137..49806245, complement)///Chromosome 3, NC_000003.12 (49805205..49813958, complement);ATP binding///ISG15 activating enzyme activity///protein binding///ubiquitin activating enzyme activity///ubiquitin-protein transferase activity///ubiquitin-protein transferase activity;ISG15-protein conjugation///cellular protein modification process///modification-dependent protein catabolic process///negative regulation of type I interferon production///protein ubiquitination///translesion synthesis;cytosol///cytosol///nucleoplasm///nucleus;GO:0005524///GO:0019782///GO:0005515///GO:0004839///GO:0004842///GO:0004842;GO:0032020///GO:0006464///GO:0019941///GO:0032480///GO:0016567///GO:0019985;GO:0005829///GO:0005829///GO:0005654///GO:0005634
1316_at;THRA;45.763;396.259;40.259;295.334;291.424;270.461;302.898;276.398;288.811;284.495;293.006;381.787;391.911;444.546;339.882;339.732;302.138;346.006;234.524;316.179;371.356;26.301;264.621;254.673;269.758;288.621;408.951;354.798;345.418;238.273;316.128;262.152;332.348;369.991;385.654;339.729;41.565;377.313;344.921;31.001;38.994;372.794;262.549;530.218;443.454;352.393;308.603;337.254;342.364;497.731;309.725;359.086;31.001;305.275;347.136;356.482;536.168;344.132;345.483;216.577;272.265;328.885;41.952;42.467;33.458;301.597;513.951;326.698;344.123;36.89;340.516;34.558;372.938;336.789;377.779;331.186;283.227;351.908;319.462;330.019;363.069;359.584;413.045;270.542;340.538;255.926;304.317;364.045;465.402;315.002;321.653;425.256;31.176;346.899;302.309;530.328;458.604;363.171;316.957;259.301;351.766;256.383;31.649;332.902;311.973;329.348;290.771;32.955;362.527;37.767;370.158;30.418;311.549;307.809;300.358;36.07;280.569;320.872;298.172;422.496;291.448;362.651;342.648;38.781;361.591;308.848;276.897;32.806;201.013;383.124;325.808;404.501;351.237;321.633;377.585;311.193;337.321;410.021;362.987;431.261;321.468;264.678;256.147;337.588;344.719;36.221;31.91;347.521;340.955;305.399;302.617;266.211;277.931;309.399;401.811;380.511;353.426;375.679;543.117;489.771;533.389;472.195;433.937;343.151;531.394;442.186;36.475;30.469;343.207;385.748;36.808;410.816;387.705;331.249;31.885;385.727;432.198;436.068;381.842;328.838;425.896;234.148;55.871;488.815;414.439;473.776;372.076;540.439;377.575;335.334;368.926;269.368;270.832;333.349;333.557;382.872;342.756;329.989;324.385;342.253;thyroid hormone receptor, alpha;THRA;7067;;;;Homo sapiens mRNA for thyroid hormone receptor alpha 1 THRA1, (c-erbA-1 gene);29878;X55005;;;;17q11.2;Chromosome 17, NC_000017.11 (40062193..40093867);TBP-class protein binding///chromatin DNA binding///intronic transcription regulatory region DNA binding///protein binding///protein complex binding///protein domain specific binding///protein heterodimerization activity///protein homodimerization activity///steroid hormone receptor activity///steroid receptor RNA activator RNA binding///thyroid hormone binding///thyroid hormone binding///thyroid hormone receptor activity///transcription factor activity, RNA polymerase II distal enhancer sequence-specific binding///transcription factor activity, sequence-specific DNA binding///transcription factor binding///transcription regulatory region DNA binding///transcription regulatory region sequence-specific DNA binding///zinc ion binding;Type I pneumocyte differentiation///adrenal gland development///brain development///cartilage condensation///cytoplasmic sequestering of transcription factor///digestive tract development///embryonic organ development///erythrocyte differentiation///female courtship behavior///hormone-mediated signaling pathway///intracellular receptor signaling pathway///kidney development///learning or memory///liver development///negative regulation of DNA-templated transcription, initiation///negative regulation of RNA polymerase II transcriptional preinitiation complex assembly///negative regulation of sequence-specific DNA binding transcription factor activity///negative regulation of transcription, DNA-templated///ossification///positive regulation of female receptivity///positive regulation of myotube differentiation///positive regulation of transcription from RNA polymerase II promoter///regulation of heart contraction///regulation of lipid catabolic process///regulation of myeloid cell apoptotic process///regulation of thyroid hormone mediated signaling pathway///regulation of transcription from RNA polymerase II promoter///response to cold///response to drug///response to nutrient levels///steroid hormone mediated signaling pathway///thyroid gland development///transcription from RNA polymerase II promoter///transcription initiation from RNA polymerase II promoter;cytosol///mitochondrion///nucleoplasm///nucleus;GO:0017025///GO:0031490///GO:0044213///GO:0005515///GO:0032403///GO:0019904///GO:0046982///GO:0042803///GO:0003707///GO:0002153///GO:0070324///GO:0070324///GO:0004887///GO:0003705///GO:0003700///GO:0008134///GO:0044212///GO:0000976///GO:0008270;GO:0060509///GO:0030325///GO:0007420///GO:0001502///GO:0042994///GO:0048565///GO:0048568///GO:0030218///GO:0008050///GO:0009755///GO:0030522///GO:0001822///GO:0007611///GO:0001889///GO:2000143///GO:0017055///GO:0043433///GO:0045892///GO:0001503///GO:0045925///GO:0010831///GO:0045944///GO:0008016///GO:0050994///GO:0033032///GO:0002155///GO:0006357///GO:0009409///GO:0042493///GO:0031667///GO:0043401///GO:0030878///GO:0006366///GO:0006367;GO:0005829///GO:0005739///GO:0005654///GO:0005634
