1320_at;PTPN21;124.317;118.371;15.754;13.299;169.928;141.406;166.832;114.688;110.312;109.256;113.239;162.442;14.574;151.161;15.897;121.671;12.571;13.407;159.622;136.464;121.242;134.506;121.003;117.659;137.864;118.484;127.009;106.527;134.414;151.401;119.907;147.869;126.328;134.448;128.369;134.522;169.002;130.628;143.184;110.941;137.816;117.669;127.415;137.651;116.048;132.386;118.457;105.008;107.381;127.017;101.553;123.597;996.785;115.277;12.331;13.384;193.882;139.539;188.594;149.843;112.441;141.158;116.811;126.601;129.514;106.154;134.484;124.559;106.191;117.691;108.694;118.769;137.906;133.196;119.794;119.878;122.835;119.244;109.315;128.079;130.159;116.108;12.876;121.491;135.547;13.225;113.618;123.327;128.707;115.465;11.385;113.826;164.247;120.969;114.863;122.269;169.346;140.187;11.114;129.135;127.931;152.651;133.172;126.846;141.017;127.657;123.274;114.473;122.035;129.786;124.904;12.476;128.664;10.062;119.801;117.414;131.054;136.078;123.187;12.588;106.547;125.004;144.586;122.455;138.089;147.414;131.334;115.932;156.208;107.122;115.584;165.661;111.872;121.019;132.286;157.267;138.922;130.407;183.131;165.653;122.457;125.473;136.311;120.148;172.758;122.749;158.379;156.344;144.072;168.886;184.183;149.557;169.029;135.828;126.225;144.506;115.475;118.194;116.215;126.501;124.231;108.779;121.412;128.349;155.229;134.173;126.509;142.778;132.728;123.759;158.157;126.777;121.429;118.413;118.903;124.903;109.307;12.702;133.887;119.428;176.856;128.088;110.314;167.444;151.844;16.712;163.924;174.947;150.682;127.517;118.155;115.157;149.075;162.781;128.022;11.753;118.393;126.291;119.774;140.755;protein tyrosine phosphatase, non-receptor type 21;PTPN21;11099;;;;H.sapiens mRNA for protein-tyrosine-phosphatase D1;532055;X79510;;;;14q31.3;Chromosome 14, NC_000014.9 (88465778..88554779, complement);protein binding///protein tyrosine phosphatase activity;peptidyl-tyrosine dephosphorylation///protein dephosphorylation;cytoplasm///cytoskeleton;GO:0005515///GO:0004725;GO:0035335///GO:0006470;GO:0005737///GO:0005856
1405_i_at;CCL5;284.923;285.391;172.411;1789.53;195.988;3573.28;353.513;229.391;260.271;213.892;406.721;341.011;257.913;149.579;101.892;270.759;684.958;682.677;137.461;103.914;941.066;241.724;845.027;216.002;905.876;144.178;107.629;435.734;200.207;350.775;159.099;1865.96;239.431;42.838;370.658;904.138;801.483;5794.96;199.256;92.865;181.537;132.575;110.328;23.619;246.865;209.172;270.565;17.847;429.714;129.964;134.861;106.156;115.127;283.033;18.685;3487.42;381.551;4213.38;4242.93;182.878;120.665;181.203;116.102;104.011;176.823;156.571;269.344;141.646;146.687;171.289;524.146;116.143;210.523;167.107;142.321;19.539;10.86;188.078;204.127;90.446;219.723;115.925;774.038;88.355;275.851;177.324;140.809;112.331;144.738;309.022;392.563;100.692;3353.31;107.982;154.788;243.607;745.167;252.163;209.517;312.605;222.255;29.144;801.025;115.426;137.142;221.068;187.339;135.183;98.372;119.516;157.215;879.764;479.731;198.952;121.472;15.625;123.742;248.202;186.3;125.297;945.915;167.658;108.637;169.329;142.955;158.992;130.656;135.339;209.208;173.499;124.096;814.059;121.738;237.128;95.938;935.586;208.206;223.829;172.623;195.692;174.358;257.905;317.649;229.324;300.494;254.928;149.211;260.378;35.166;499.951;128.413;914.598;148.727;39.46;976.754;194.641;360.352;794.385;89.829;735.489;952.062;622.371;329.879;297.414;4583.39;235.881;128.156;236.932;311.119;14.527;206.332;321.743;170.093;327.388;127.348;140.211;286.061;13.58;261.498;347.272;147.744;302.465;144.221;224.696;177.607;197.751;165.479;19.816;195.886;127.565;177.565;408.286;405.735;926.882;145.606;192.929;241.506;188.332;281.467;172.874;C-C motif chemokine ligand 5;CCL5;6352;;;;Human T cell-specific protein (RANTES) mRNA, complete cds;339420;M21121;;;;17q12;Chromosome 17, NC_000017.11 (35871491..35880373, complement);CCR1 chemokine receptor binding///CCR1 chemokine receptor binding///CCR1 chemokine receptor binding///CCR4 chemokine receptor binding///CCR5 chemokine receptor binding///chemoattractant activity///chemokine activity///chemokine activity///chemokine receptor antagonist activity///chemokine receptor binding///heparin binding///phosphatidylinositol phospholipase C activity///phospholipase activator activity///protein binding///protein homodimerization activity///protein kinase activity///protein self-association///receptor signaling protein tyrosine kinase activator activity;G-protein coupled receptor signaling pathway///MAPK cascade///activation of phospholipase D activity///aging///calcium ion transport///cell-cell signaling///cellular calcium ion homeostasis///cellular protein complex assembly///cellular response to alkyl hydroperoxide///cellular response to amino acid stimulus///cellular response to ethanol///cellular response to fibroblast growth factor stimulus///cellular response to high density lipoprotein particle stimulus///cellular response to interferon-gamma///cellular response to interleukin-1///cellular response to morphine///cellular response to organic cyclic compound///cellular response to transforming growth factor beta stimulus///cellular response to tumor necrosis factor///cellular response to vitamin K///chemokine-mediated signaling pathway///chemokine-mediated signaling pathway///chemotaxis///chronic inflammatory response///dendritic cell chemotaxis///dibenzo-p-dioxin metabolic process///eosinophil chemotaxis///exocytosis///inflammatory response///leukocyte cell-cell adhesion///lipopolysaccharide-mediated signaling pathway///lymphocyte chemotaxis///macrophage chemotaxis///monocyte chemotaxis///negative regulation by host of viral transcription///negative regulation of G-protein coupled receptor protein signaling pathway///negative regulation of T cell apoptotic process///negative regulation of chemokine-mediated signaling pathway///negative regulation of macrophage apoptotic process///negative regulation of neuron death///negative regulation of viral genome replication///neutrophil activation///neutrophil chemotaxis///positive chemotaxis///positive regulation of ERK1 and ERK2 cascade///positive regulation of GTPase activity///positive regulation of JAK-STAT cascade///positive regulation of T cell apoptotic process///positive regulation of T cell chemotaxis///positive regulation of T cell migration///positive regulation of T cell proliferation///positive regulation of activation of JAK2 kinase activity///positive regulation of angiogenesis///positive regulation of calcium ion transport///positive regulation of cell adhesion///positive regulation of cell migration///positive regulation of cell-cell adhesion mediated by integrin///positive regulation of cellular biosynthetic process///positive regulation of epithelial cell proliferation///positive regulation of fever generation///positive regulation of homotypic cell-cell adhesion///positive regulation of inflammatory response///positive regulation of innate immune response///positive regulation of macrophage chemotaxis///positive regulation of mast cell chemotaxis///positive regulation of monocyte chemotaxis///positive regulation of natural killer cell chemotaxis///positive regulation of neuron differentiation///positive regulation of osteoclast differentiation///positive regulation of phosphatidylinositol 3-kinase signaling///positive regulation of phosphorylation///positive regulation of protein tyrosine kinase activity///positive regulation of smooth muscle cell migration///positive regulation of smooth muscle cell proliferation///positive regulation of translational initiation///positive regulation of tyrosine phosphorylation of STAT protein///positive regulation of viral genome replication///protein kinase B signaling///protein tetramerization///regulation of T cell activation///regulation of chronic inflammatory response///regulation of insulin secretion///regulation of neuron death///response to activity///response to cholesterol///response to drug///response to estrogen///response to glucocorticoid///response to insulin///response to salt stress///response to toxic substance///response to virus;cytoplasm///extracellular region///extracellular space;GO:0031726///GO:0031726///GO:0031726///GO:0031729///GO:0031730///GO:0042056///GO:0008009///GO:0008009///GO:0046817///GO:0042379///GO:0008201///GO:0004435///GO:0016004///GO:0005515///GO:0042803///GO:0004672///GO:0043621///GO:0030298;GO:0007186///GO:0000165///GO:0031584///GO:0007568///GO:0006816///GO:0007267///GO:0006874///GO:0043623///GO:0071448///GO:0071230///GO:0071361///GO:0044344///GO:0071403///GO:0071346///GO:0071347///GO:0071315///GO:0071407///GO:0071560///GO:0071356///GO:0071307///GO:0070098///GO:0070098///GO:0006935///GO:0002544///GO:0002407///GO:0018894///GO:0048245///GO:0006887///GO:0006954///GO:0007159///GO:0031663///GO:0048247///GO:0048246///GO:0002548///GO:0043922///GO:0045744///GO:0070233///GO:0070100///GO:2000110///GO:1901215///GO:0045071///GO:0042119///GO:0030593///GO:0050918///GO:0070374///GO:0043547///GO:0046427///GO:0070234///GO:0010820///GO:2000406///GO:0042102///GO:0010535///GO:0045766///GO:0051928///GO:0045785///GO:0030335///GO:0033634///GO:0031328///GO:0050679///GO:0031622///GO:0034112///GO:0050729///GO:0045089///GO:0010759///GO:0060754///GO:0090026///GO:2000503///GO:0045666///GO:0045672///GO:0014068///GO:0042327///GO:0061098///GO:0014911///GO:0048661///GO:0045948///GO:0042531///GO:0045070///GO:0043491///GO:0051262///GO:0050863///GO:0002676///GO:0050796///GO:1901214///GO:0014823///GO:0070723///GO:0042493///GO:0043627///GO:0051384///GO:0032868///GO:0009651///GO:0009636///GO:0009615;GO:0005737///GO:0005576///GO:0005615
1431_at;CYP2E1;118.678;125.965;137.284;18.348;133.001;12.545;128.837;916.758;116.569;11.044;154.587;141.054;155.657;137.915;119.446;10.757;945.085;125.935;16.191;12.494;121.714;130.226;123.009;411.538;180.622;15.983;12.407;12.923;124.641;110.468;122.572;14.584;115.094;20.329;113.248;12.14;143.269;122.413;133.652;123.566;115.488;114.814;973.734;121.152;152.483;117.115;128.037;10.792;121.622;996.641;13.813;115.745;118.274;126.945;14.271;114.829;236.795;115.541;168.214;913.009;93.143;131.216;106.831;128.685;113.359;113.394;111.341;119.884;20.836;103.001;106.007;117.194;113.378;141.982;175.175;109.758;149.107;130.842;103.527;997.863;305.388;163.917;142.484;127.475;131.625;147.334;12.272;160.412;134.915;127.863;137.621;119.311;129.437;12.17;13.808;124.687;119.827;130.563;119.384;142.286;428.759;120.743;163.677;125.948;111.639;12.695;114.344;12.682;137.599;115.887;104.182;105.188;128.289;981.075;102.485;119.375;126.943;156.505;858.829;115.255;185.826;145.732;103.923;143.969;128.173;106.147;145.049;134.521;131.097;127.101;104.493;113.299;122.384;123.208;120.415;14.845;159.693;230.261;140.874;137.089;124.942;116.347;147.681;132.726;127.752;110.723;131.522;142.298;129.178;279.236;122.217;167.692;107.195;110.204;248.327;538.699;150.273;11.504;116.885;438.261;186.443;121.418;121.985;108.085;141.924;118.448;135.815;201.279;127.001;156.091;119.458;309.957;133.557;227.694;148.219;12.055;129.703;129.225;157.258;174.764;12.702;119.764;132.628;129.919;130.262;125.614;131.669;132.787;140.011;144.227;135.547;129.775;144.504;145.696;115.009;117.208;111.368;119.987;129.752;126.547;cytochrome P450 family 2 subfamily E member 1;CYP2E1;1571;;;;Human cytochrome P450IIE1 (ethanol-inducible) gene, complete cds;181355;J02843;;;;10q26.3;Chromosome 10, NC_000010.11 (133527363..133539116);arachidonic acid epoxygenase activity///enzyme binding///heme binding///iron ion binding///monooxygenase activity///oxidoreductase activity///oxidoreductase activity, acting on paired donors, with incorporation or reduction of molecular oxygen, NAD(P)H as one donor, and incorporation of one atom of oxygen///oxidoreductase activity, acting on paired donors, with incorporation or reduction of molecular oxygen, reduced flavin or flavoprotein as one donor, and incorporation of one atom of oxygen///oxygen binding///steroid hydroxylase activity;benzene metabolic process///carbon tetrachloride metabolic process///drug metabolic process///drug metabolic process///drug metabolic process///epoxygenase P450 pathway///halogenated hydrocarbon metabolic process///heterocycle metabolic process///monoterpenoid metabolic process///oxidation-reduction process///response to drug///response to ethanol///response to organonitrogen compound///response to ozone///steroid metabolic process///triglyceride metabolic process///xenobiotic metabolic process;Golgi membrane///endoplasmic reticulum membrane///intrinsic component of endoplasmic reticulum membrane///mitochondrion;GO:0008392///GO:0019899///GO:0020037///GO:0005506///GO:0004497///GO:0016491///GO:0016709///GO:0016712///GO:0019825///GO:0008395;GO:0018910///GO:0018885///GO:0017144///GO:0017144///GO:0017144///GO:0019373///GO:0042197///GO:0046483///GO:0016098///GO:0055114///GO:0042493///GO:0045471///GO:0010243///GO:0010193///GO:0008202///GO:0006641///GO:0006805;GO:0000139///GO:0005789///GO:0031227///GO:0005739
1438_at;EPHB3;215.536;200.523;349.379;254.505;393.751;368.077;427.194;21.361;232.001;233.412;282.995;495.874;418.248;383.014;352.679;297.116;274.943;294.622;345.605;270.925;255.054;205.937;253.129;179.148;226.271;174.159;24.469;224.349;258.458;222.552;230.566;28.417;188.498;236.218;242.612;281.774;334.101;325.893;287.035;269.113;238.209;224.993;248.356;261.605;226.277;282.873;275.097;236.254;245.222;234.324;218.944;24.405;225.677;169.361;181.137;280.908;322.454;495.673;426.253;22.232;189.331;23.301;265.223;243.155;287.552;242.322;218.289;26.469;258.506;241.159;261.716;267.489;265.696;267.518;261.987;261.318;233.521;24.72;213.221;237.352;225.518;246.116;23.697;258.064;282.885;324.151;254.011;276.294;252.415;296.045;268.742;225.396;416.231;251.163;271.714;220.095;392.215;367.699;27.052;258.527;242.886;344.641;295.111;245.187;323.754;296.948;25.605;24.296;259.559;293.351;272.987;270.252;268.261;219.974;235.555;20.991;247.601;231.415;215.639;22.101;208.482;214.516;269.021;234.866;298.172;284.303;318.962;249.046;16.435;19.328;29.527;287.239;223.506;225.066;247.029;268.936;26.617;297.928;421.937;394.056;26.288;277.523;168.423;19.4;409.357;262.298;285.218;31.376;323.527;351.354;311.258;261.544;307.959;316.239;247.539;267.087;21.541;214.527;234.189;222.695;230.549;235.969;252.578;253.234;338.825;288.668;316.518;305.217;260.415;258.728;295.816;23.456;261.826;213.636;294.949;258.527;250.675;262.275;241.166;247.347;317.766;170.461;281.211;407.466;338.721;317.314;393.652;458.344;478.613;275.983;257.123;232.715;314.317;303.515;260.617;243.694;217.874;289.817;244.829;235.568;EPH receptor B3;EPHB3;2049;;;;H.sapiens HEK2 mRNA for protein tyrosine kinase receptor;406867;X75208;;;;3q27.1;Chromosome 3, NC_000003.12 (184561799..184582408);ATP binding///axon guidance receptor activity///ephrin receptor activity;angiogenesis///axon guidance///axonal fasciculation///cell migration///central nervous system projection neuron axonogenesis///corpus callosum development///dendritic spine development///dendritic spine morphogenesis///digestive tract morphogenesis///ephrin receptor signaling pathway///ephrin receptor signaling pathway///palate development///peptidyl-tyrosine phosphorylation///positive regulation of synapse assembly///protein autophosphorylation///regulation of GTPase activity///regulation of axonogenesis///regulation of cell-cell adhesion///retinal ganglion cell axon guidance///substrate adhesion-dependent cell spreading///thymus development///urogenital system development;cytosol///dendrite///extracellular region///integral component of plasma membrane///plasma membrane;GO:0005524///GO:0008046///GO:0005003;GO:0001525///GO:0007411///GO:0007413///GO:0016477///GO:0021952///GO:0022038///GO:0060996///GO:0060997///GO:0048546///GO:0048013///GO:0048013///GO:0060021///GO:0018108///GO:0051965///GO:0046777///GO:0043087///GO:0050770///GO:0022407///GO:0031290///GO:0034446///GO:0048538///GO:0001655;GO:0005829///GO:0030425///GO:0005576///GO:0005887///GO:0005886
1487_at;ESRRA;793.121;800.743;797.268;889.986;826.951;102.474;102.028;714.607;851.927;690.093;826.057;102.651;995.072;902.626;824.801;864.268;854.039;105.469;970.625;971.746;933.681;100.531;904.979;153.45;932.437;937.051;879.168;847.718;990.583;120.322;686.542;124.931;857.631;105.094;941.627;945.119;778.368;882.897;972.831;858.326;874.454;118.409;834.582;985.974;158.063;773.999;109.074;824.564;846.939;671.777;674.815;115.014;711.794;106.231;880.444;124.521;114.153;104.142;102.763;713.803;127.523;110.205;821.717;879.612;808.249;879.128;113.736;968.111;990.333;948.769;109.397;810.085;128.322;109.045;110.37;105.638;116.875;897.262;712.217;953.901;120.908;112.784;989.594;793.814;110.151;103.787;77.89;947.343;99.061;733.992;100.714;972.262;858.999;940.101;711.679;848.985;101.641;868.114;644.841;914.326;125.368;103.91;133.636;712.994;118.991;111.782;119.156;791.544;904.963;844.152;812.826;760.312;125.781;641.262;857.762;791.174;921.618;104.624;114.794;101.273;851.551;928.089;104.739;101.515;120.823;128.644;942.535;896.728;147.175;137.47;107.875;214.723;783.614;934.472;952.939;144.716;161.096;147.349;155.896;974.436;73.9;706.144;650.147;871.191;118.867;117.423;126.924;952.116;137.507;152.395;139.471;110.409;927.112;114.823;111.637;141.276;119.352;107.146;135.332;140.752;161.894;913.002;110.858;103.902;129.297;993.505;103.113;102.344;131.503;116.209;845.842;101.447;118.533;106.775;102.44;900.621;85.165;777.933;104.19;105.552;992.066;120.703;133.33;898.919;92.229;966.282;953.274;788.301;819.973;877.293;946.558;870.212;106.173;871.828;928.499;884.935;676.518;660.618;645.103;693.164;estrogen related receptor alpha;ESRRA;2101;;;;Human estrogen receptor-related protein (hERRa1) mRNA, 3' end, partial cds;1239956;L38487;;;;11q13;Chromosome 11, NC_000011.10 (64305528..64316743);DNA binding///RNA polymerase II core promoter proximal region sequence-specific DNA binding///RNA polymerase II transcription factor activity, ligand-activated sequence-specific DNA binding///protein binding///protein domain specific binding///sequence-specific DNA binding///steroid binding///steroid hormone receptor activity///transcriptional activator activity, RNA polymerase II core promoter proximal region sequence-specific binding///transcriptional repressor activity, RNA polymerase II core promoter proximal region sequence-specific binding///zinc ion binding;cartilage development///intracellular receptor signaling pathway///mitochondrion organization///negative regulation of transcription from RNA polymerase II promoter///positive regulation of cellular response to insulin stimulus///positive regulation of transcription from RNA polymerase II promoter///regulation of cell proliferation///regulation of osteoblast differentiation///regulation of osteoclast differentiation///regulation of transcription, DNA-templated///response to estradiol///steroid hormone mediated signaling pathway///transcription initiation from RNA polymerase II promoter;intercellular bridge///microtubule cytoskeleton///nucleolus///nucleoplasm///nucleus;GO:0003677///GO:0000978///GO:0004879///GO:0005515///GO:0019904///GO:0043565///GO:0005496///GO:0003707///GO:0001077///GO:0001078///GO:0008270;GO:0051216///GO:0030522///GO:0007005///GO:0000122///GO:1900078///GO:0045944///GO:0042127///GO:0045667///GO:0045670///GO:0006355///GO:0032355///GO:0043401///GO:0006367;GO:0045171///GO:0015630///GO:0005730///GO:0005654///GO:0005634
1494_f_at;CYP2A6;290.308;317.123;423.273;286.606;398.348;379.556;567.642;317.577;321.786;28.672;383.749;483.931;550.564;454.141;446.758;286.542;319.511;295.465;363.779;297.218;32.284;272.089;317.026;279.751;247.507;230.867;32.901;350.441;307.823;380.562;319.192;372.743;363.001;31.809;358.546;29.149;414.667;378.409;305.355;283.694;263.993;345.381;286.024;327.868;390.284;298.172;331.595;306.129;243.197;284.006;294.275;286.248;271.108;267.492;231.776;405.924;44.235;63.165;62.459;277.338;273.952;303.641;298.283;290.523;320.566;293.851;349.593;303.286;269.394;313.972;268.813;291.689;282.936;314.968;292.713;330.617;331.162;322.352;308.303;374.969;325.201;338.501;305.212;360.586;292.734;402.959;369.834;308.356;337.442;277.376;300.234;341.841;416.054;320.973;360.797;360.768;575.771;423.952;310.203;25.953;309.488;298.395;316.743;266.249;367.246;412.395;352.841;284.382;301.621;321.225;369.558;369.635;323.921;227.235;358.911;325.321;358.604;326.698;329.603;319.698;308.056;36.582;30.963;389.585;338.437;262.523;37.716;320.194;22.423;289.647;328.572;366.489;337.305;285.236;315.232;423.296;361.728;324.785;559.123;456.938;300.929;305.149;317.555;334.462;455.328;332.034;29.644;34.683;502.093;33.059;346.365;347.336;327.995;337.117;310.049;334.537;305.448;299.327;289.462;323.711;301.445;300.299;334.402;309.909;431.906;338.733;292.162;283.748;325.937;335.832;327.614;293.716;374.223;285.039;310.284;26.39;297.858;331.756;312.417;309.212;326.748;271.252;35.106;411.382;464.385;390.277;531.466;49.87;441.208;298.328;297.805;311.131;297.987;34.181;314.495;267.742;294.071;280.627;321.908;268.738;cytochrome P450 family 2 subfamily A member 6;CYP2A6;1548;;;;Human cytochrome P450IIA3 (CYP2A3) mRNA, complete cds;180986;M33318;;;;19q13.2;Chromosome 19, NC_000019.10 (40843538..40850447, complement);arachidonic acid epoxygenase activity///coumarin 7-hydroxylase activity///coumarin 7-hydroxylase activity///enzyme binding///heme binding///iron ion binding///oxidoreductase activity, acting on paired donors, with incorporation or reduction of molecular oxygen, reduced flavin or flavoprotein as one donor, and incorporation of one atom of oxygen///steroid hydroxylase activity;coumarin catabolic process///coumarin metabolic process///coumarin metabolic process///drug metabolic process///drug metabolic process///epoxygenase P450 pathway///exogenous drug catabolic process///oxidation-reduction process///steroid metabolic process;cytoplasmic microtubule///endoplasmic reticulum membrane///organelle membrane;GO:0008392///GO:0008389///GO:0008389///GO:0019899///GO:0020037///GO:0005506///GO:0016712///GO:0008395;GO:0046226///GO:0009804///GO:0009804///GO:0017144///GO:0017144///GO:0019373///GO:0042738///GO:0055114///GO:0008202;GO:0005881///GO:0005789///GO:0031090
